{
  "bundle_id": "BUNDLE-SAMPLE-RESOLVED",
  "query_text_segmented": "thời_hạn cấp_đổi thẻ căn_cước là bao_lâu",
  "resolved_procedure_id": "PROC-001",
  "top_score": 0.91,
  "second_score": 0.42,
  "margin": 0.49,
  "confidence_status": "resolved",
  "ambiguous_candidates": [],
  "evidence": [
    {
      "fragment_id": "FRAG-001-time",
      "procedure_id": "PROC-001",
      "text": "Thời hạn giải quyết cấp đổi thẻ căn cước công dân: 7 ngày làm việc kể từ khi nhận đủ hồ sơ (dữ liệu mẫu để kiểm thử).",
      "score": 0.91,
      "method": "fused",
      "source_id": "SRC-SAMPLE-001",
      "source_version": "sample-1",
      "effective_date": "2024-01-01",
      "source_locator": "Điều 1, khoản 2 (mẫu)"
    },
    {
      "fragment_id": "FRAG-001-fee",
      "procedure_id": "PROC-001",
      "text": "Lệ phí cấp đổi thẻ căn cước công dân: 30.000 đồng (dữ liệu mẫu để kiểm thử).",
      "score": 0.58,
      "method": "fused",
      "source_id": "SRC-SAMPLE-001",
      "source_version": "sample-1",
      "effective_date": "2024-01-01",
      "source_locator": "Điều 1, khoản 1 (mẫu)"
    }
  ],
  "fusion_method": "weighted_sum(bm25_norm, cosine) [placeholder]",
  "created_at": "2026-09-28T00:00:00Z"
}
