{
  "bundle_id": "BUNDLE-SAMPLE-LOW",
  "query_text_segmented": "xin giấy_phép lái tàu vũ_trụ",
  "resolved_procedure_id": null,
  "top_score": 0.31,
  "second_score": 0.28,
  "margin": 0.03,
  "confidence_status": "low_confidence",
  "ambiguous_candidates": [],
  "evidence": [],
  "fusion_method": "weighted_sum(bm25_norm, cosine) [placeholder]",
  "created_at": "2026-09-28T00:00:00Z"
}
